{
  "$schema": "../schemas/academy-training.schema.json",
  "location": "ACADEMY",
  "level": 7,
  "partners": [
    {
      "id": "T_CAT",
      "species": "CLAW_CAT",
      "name": "借用利爪猫",
      "element": "水",
      "stats": [
        306,
        88,
        44,
        55,
        46,
        55,
        37
      ],
      "skills": [
        "水弹",
        "微疗"
      ]
    },
    {
      "id": "T_STONE",
      "species": "STONE_GOLEM",
      "name": "借用小岩怪",
      "element": "地",
      "stats": [
        460,
        51,
        55,
        27,
        68,
        41,
        20
      ],
      "skills": [
        "碎岩击",
        "掩护"
      ]
    },
    {
      "id": "T_SPROUT",
      "species": "SPROUT",
      "name": "借用芽灵",
      "element": "木",
      "stats": [
        378,
        88,
        27,
        50,
        55,
        55,
        23
      ],
      "skills": [
        "藤鞭",
        "微疗"
      ]
    },
    {
      "id": "T_GALE",
      "species": "GALE_SPARROW",
      "name": "借用青岚雀",
      "element": "风",
      "stats": [
        302,
        81,
        33,
        49,
        44,
        49,
        48
      ],
      "skills": [
        "风刃",
        "逆风"
      ]
    },
    {
      "id": "T_RABBIT",
      "species": "FLAME_RABBIT",
      "name": "借用紫炎兔",
      "element": "火",
      "stats": [
        288,
        108,
        33,
        69,
        38,
        49,
        37
      ],
      "skills": [
        "火球术",
        "烈焰冲击"
      ]
    }
  ],
  "capture": {
    "level": 11,
    "species": "STONE_GOLEM",
    "stats": {
      "T_CAT": [
        408,
        109,
        60,
        75,
        63,
        75,
        46
      ],
      "T_STONE": [
        614,
        63,
        75,
        37,
        93,
        56,
        25
      ]
    },
    "supplies": {
      "SEAL_I": 8,
      "SEAL_II": 8,
      "HEALTH_POTION_II": 12,
      "MANA_POTION_II": 4
    }
  },
  "courses": {
    "ACADEMY_DEFENSE": {
      "name": "全队一起行动",
      "requires": "QUEST:O012",
      "goal": "DEFENSE",
      "rounds": 20,
      "enemyHealth": 800,
      "enemyAttack": 35,
      "enemyDefense": 55,
      "enemySpeed": 10,
      "power": 100,
      "objective": "人物与两只借用伙伴各执行一次合法指令；人物防御承受已预告重击，随后击败木靶。"
    },
    "ACADEMY_SWAP": {
      "name": "留给替补的位置",
      "requires": "QUEST:O012",
      "goal": "SWAP",
      "rounds": 20,
      "enemyHealth": 900,
      "enemyAttack": 45,
      "enemyDefense": 55,
      "enemySpeed": 10,
      "power": 100,
      "objective": "先选两只出战、两只替补；战内主动换入一次。第五只只随身携带，不能上场。"
    },
    "ACADEMY_CAPTURE": {
      "name": "看懂属性与封印球",
      "requires": "QUEST:O012",
      "goal": "CAPTURE",
      "rounds": 100,
      "enemyHealth": 614,
      "enemyAttack": 75,
      "enemyDefense": 93,
      "enemySpeed": 25,
      "power": 80,
      "objective": "查看目标公开资料与I/II球覆盖范围；削弱后合法捕捉，捕获投影与物品均不可带出。"
    },
    "ACADEMY_PROFESSION": {
      "name": "我的职业办法",
      "requires": "QUEST:O012",
      "goal": "PROFESSION",
      "rounds": 9,
      "enemyHealth": 2000,
      "enemyAttack": 1,
      "enemyDefense": 55,
      "enemySpeed": 10,
      "power": 0,
      "objective": "完成本职业专属练习，永久掌握职业技能。"
    },
    "O013": {
      "name": "行路前的替补实践",
      "requires": "QUEST_ACCEPT:O013",
      "goal": "SWAP",
      "rounds": 6,
      "enemyHealth": 900,
      "enemyAttack": 35,
      "enemyDefense": 55,
      "enemySpeed": 10,
      "power": 100,
      "objective": "选四只借用伙伴，前两只出战、后两只替补；战斗中主动换入一只替补即可结束实践。借用资源不带出。"
    }
  }
}
